id,permalink,date,subreddit,gildings,title,url,body
4dkzy8,https://www.reddit.com/r/DawnPowers/comments/4dkzy8/the_iron_city_tech_expansion_rp/,2016-04-06 09:15:14 UTC,DawnPowers,0,"The Iron City [Tech, Expansion & RP]",/r/DawnPowers/comments/4dkzy8/the_iron_city_tech_expansion_rp/,"As time progressed, our friends to the south told us of a new metal, apparently to be found abundantly. Since the [Decimation of the Iz](https://www.reddit.com/r/DawnPowers/comments/4d77ic/decimation_on_the_iz/) this metal had been used in Zefar lands, now the invention finally reached Aquitinia. The government had been worried at a severe lack of iron in Aquitinian lands, but a [series of expeditions north](https://www.reddit.com/r/DawnPowers/comments/4cr8qj/legends_of_fortune/) resulted in the finding of much [iron ore](https://en.wikipedia.org/wiki/Hematite). The ore itself was of no use to the Aquitinians, but new methods used in Zefar, and Tekata soon remedied that, and **Iron Working** became common in smithies to the [north](http://imgur.com/0KbrzVX). Great Iron mines were constructed, together with large smithies. This led to a booming industry, as the whole country was ironed (pun intended). The merchants who practically owned the new city (Ketalida), quickly became rich, through their new monopoly, this soon led to the [Corruption of the Kazern](https://www.reddit.com/r/DawnPowers/comments/4dh58w/hidden_in_plain_sight/).

Together with these new methods for working iron, certain tools were imported, among those were **Bloomeries**, **Bellows** and the ~~**Tuyere**~~.

---

[Expansion](http://imgur.com/0KbrzVX)

Tech:

* Iron Working

* Bloomeries

* Bellows

* ~~Tuyere~~

(Stolen from Zefarri & Tekata)

---

The region to the northwest has been volcanic, and thus hematite, among others is much more common there."
4u50qr,https://www.reddit.com/r/DawnPowers/comments/4u50qr/strange_skies_evil_riders_crisis_pt_1/,2016-07-22 21:12:30 UTC,DawnPowers,0,"Strange Skies, Evil Riders [Crisis Pt 1]",/r/DawnPowers/comments/4u50qr/strange_skies_evil_riders_crisis_pt_1/,"##Crisis in SW dawn

During the summer of 389 BCE, a strange phenomenon happened in the skies, a the brief birth of a bright star, but it quickly passed, fading from the skies in a matter of days. Most never even noticed it's coming, but those who did were worried. The sign didn't come alone, the red star passed over the sky during the same week. This red ""star"" was often seen as the sign of war, and combined with the other events on the sky, people called it an omen.

---

In many places, the omen was ignored, but one lord heeded it, he and his riders took it as a blessing from his gods, and rode to war with his neighbors, swiftly subduing the surrounding lands.

However, he didn't stop there, the men of the conquered lords saw him as a man from the gods, and followed him as he rode further, and further from home.

---

During the spring of 383, he reached the lands of the Kelashi, quickly entering the realm on their horses, the Mehnu's men plundering, killing, and raping as they, went offing any lords that didn't bend their knee. Unlike any other armies, these were swift, and left no time to prepare.

---

So, the Crisis is in SW dawn, according to [this map](http://imgur.com/a/cWSi4). 

These raiders burn, subjugate and destabilize your societies, if nothing, or very little is done, you might just become the vassal of a new ""Mongol"" empire of sorts.



You don't *have* to RP anything on the astronomical phenomenons, but it would of course be a nice addition.

EDIT: (To clarify, anyone could use these omens for their RP, as it would be seen by most.)"
4tk76e,https://www.reddit.com/r/DawnPowers/comments/4tk76e/500400_techs_war_time_and_iron/,2016-07-19 09:03:11 UTC,DawnPowers,0,"[500-400 Techs] War, time and Iron",/r/DawnPowers/comments/4tk76e/500400_techs_war_time_and_iron/,"* **Iron** from the hashas, the methods of iron were taught to the Enli ~550 BCE

* Moonar Calendar (Thought I got this a while ago, refer to the RP with astronomy.)

* After a long time visiting Ashad lands, merchants brought their methods home, and soon the usage of **quern stones** and  became widespread. These would come to great use at harvests, and allow peasants to get more food for their work.

* Tao, and Enli peasants were close by, some neighbors. The Tao were often seen using tools such as the **Sickle** at harvests, and the Enli soon got them too, as they were fairly effective at their job.

* In ashadite harbours **cats** could be seen, sneaking around. Upon question, the ashad said they were used for vermin control. The Enli soon got their hands on a few of them, and brought them home on their ships.

* During the raids in the ongin lands, the Enli learned several things from them. Among these were the usage of **saddles**, **reins** and **stirrups**. These came to great help when riding horses, and the couriers of Al-Kapor soon learned how to use them.

* Along with rich people came the desire for good foods. Visitors in Ashad lands had tasted **honey preserved** foods that where very sweet. Upon question, they answered that the sweetness came from the honey of **bees**, these had been **domesticated** ages ago in Ershutisharu. So, a bee keeper was taken to Aden, and he was allowed to build **apiaries** and keep bees.



"
47e1af,https://www.reddit.com/r/DawnPowers/comments/47e1af/a_fleet_arriving_in_telebra/,2016-02-24 18:27:17 UTC,DawnPowers,0,A fleet arriving in Telebra,/r/DawnPowers/comments/47e1af/a_fleet_arriving_in_telebra/,"After the murder of Zellod, and the election of Aliena, the relations between Aquitinia and the Imperium had become strained. An official embargo on all trade coming to and fro Tenebrae had been issued, and a mobilization of the Aquitinian army and fleet had been made. Garrisons were being manned, and a small army* [~50 soldiers] *arrived to the [Aquitinian settlements](https://www.reddit.com/r/DawnPowers/comments/467fh7/how_about_an_agreement/) near Gailunda.*

Soon after the war began, (between imperium and ReebokThanBaa) a small fleet of Aquitinian ships arrived outside Telebra, small figures carrying bows could be seen from the shore, standing on the decks of the ships. One of the boats slowly approached the shore, carrying six armed guards, an envoy, and a translator.
"
44qccr,https://www.reddit.com/r/DawnPowers/comments/44qccr/aquitinian_research/,2016-02-08 10:21:01 UTC,DawnPowers,0,Aquitinian research,/r/DawnPowers/comments/44qccr/aquitinian_research/,"**Diffused Techs**


The Aquitinians, always interested in the ways of the sea have carefully studied the more advanced ways of navigation used by the Tao-Lei. Through their unending curiosity they managed to learn about **Celestial navigation**. They have also noticed that during daytime, the Tao-Lei study the birds of the seas, and the currents of the sea acquiring **bird and current navigation** (are those one tech?). They have also noticed a slight difference in the way the Tao-Lei have formed their oars. They tried duplicating it, and when comparing to normal oars, the **Sculling oars** where superior.


**Natural techs**


The aquitinians have always sought more water-resistant clothes and have, after a lot of experimentation, realized that **tanning** hides leads to the more water resistant leather being produced.

After accidentaly catching shrimps in a fish trap, the Aquitinians noticed that these creatures of the sea where remarkably tasty. So they went about catching more of them. This resulted in the **Shrimp trap** being constructed.

After realizing that leather was waterproof, the Aquitinians thought: You can keep water in it, if its waterproof! So after some experimentation they realized that lining the leather with the bladder of sanga cattle prevented water from seeping out, they had a **Water skin**.

After moving into the new region of Shalone, the Aquitinians noticed a strange creature (the guinea fowl). So they called upon their more animal-cunning friends, the Orlo. The orlo quickly tamed the Guinea fowl. **Domesticated Guinea Fowl**.

After a lot of bad experiences with canoes capsizing in bad weather, the Aquitinians thought, wood floats, what if you extended the canoe on either side? Thus the first **Outrigger canoe** was built.

In the new region of Shalone, a party of Orlo travelling in the northern parts noticed a strange plant. Through their knowledge of herbalism, they managed to domesticate the new crop known as **rice**.

If I did something wrong here, just tell me! (I'm very inexperienced with research & stuff, first tech post)"
4htki4,https://www.reddit.com/r/DawnPowers/comments/4htki4/naval_experience_tech_1000900bce/,2016-05-04 08:21:01 UTC,DawnPowers,0,Naval Experience [Tech 1000-900BCE],/r/DawnPowers/comments/4htki4/naval_experience_tech_1000900bce/,"Throughout the beginning of this century we crewed the ever growing ships of the merchants. Deep sea trade, and the high seas forced our employers to rethink. They not only thought in two plains, but built higher boats, with more masts. We were the first to sail these ships, but when the war came, they were our homes. They served us well, and they will continue to serve us. [A step towards Dhows, but these ships are nothing near the real thing]

During our years at sea, we came across many foreign ships, some of which we kept, as our own, and others, whom joined us. At the end of the century, a small fleet of **mtepes** and ~~**biremes**~~ rested in the harbor of Gur Tzi. [Diffused from Tao, Tenebrae & Rewbokh.]

~~In the bay of Gur Tzi, large waves often crashed ashore, tipping smaller boats, and sweeping resources and loot out to sea. To hinder this, we built **breakwaters**, to keep our little bay safe.~~

Large ships not only carried more cargo and men, but also sat deeper in the water. This led to problems, as Gur Tzi was located in shallow waters. Ferrying the cargo by smaller boats worked, but was very inefficient in the long run. To solve this problem, we set stone into the sea bed, and made a **pier** into deeper waters.

Sometimes, when we looted Tao ships, we came across small chests, containing round metal pieces. When inquiring to some friends from the Tao settlement on Bakku, they said that they were **coins**, a kind of currency used in Tao-Lei. This currency soon got a foothold in our city.

These chests not only held coins, they had another secret, **hinges**. This mechanism soon came to use in the growing society, on the coast of Ihai.

During pirate raids, one of the sailors came up with an idea:

If anchors could be used to fasten the ship to the sea bed, wouldn't it be able to hold another ship fast?

The answer soon came, after some experimentation, a local smith made a lighter anchor, with four arms instead of two. After a couple of succesful attacks, it got its name. The **grappling hook**.


**EDIT**

A tool that had been found in the burned city of Zefar-Nam, while scavenging, had been the **simple pulley**. It had quite a lot of uses, at it made the use of manpower more efficient. This tool had originally used to construct buildings was now put to work, lifting heave cargo into the city of Gur-Tzi. With the help from some of the Tao, that had come to the city, this tool was replicated.

As boats came, and went throughout the day, and night, some ships missed the harbor, as they did not see it in the dark. One of the ancient legends came to use here, the old story of the tower, with a fire in the cities of murtavira, that guided seafarers to their destination. At first, a smaller **lighthouse** was built, but in time, a bigger, and higher one was built, with the help of pullies."
13u3imm,https://www.reddit.com/r/DawnPowers/comments/13u3imm/serengrys/,2023-05-28 15:45:26 UTC,DawnPowers,0,Serengrys,/r/DawnPowers/comments/13u3imm/serengrys/,"In the center of the house was a crackling fire, radiating warmth to those huddled around it. Outside, the wind was howling, snow slowly but surely piling around the walls and onto the roof. In this weather, perhaps the coldest in memory, there was little to do. Yet, even so, the adults were working on small crafts, repairing tools, clothes and making arrows in the dim light.

The words of a girl could be heard, ""Oma"", she said, looking to the old woman with affection, ""would you please tell the story of the Winter Wanderer again?""

Oma smiled, looking up tiredly to meet the eyes of the girl. ""Of course, little one."", she replied. Her breathing was shallow, and she could feel the chill in her bones, yet, all that seemed a little more distant when all eyes settled on her, eager to listen. These tales that she herself had listened to in winters long ago she now told and retold.

She began, ""Long, long ago, before the trees of this house were even saplings, when the great ancients still walked the world...""

A noise interrupted the woman, and the little girl took the opportunity to ask a question. ""The great ancients? What were those Oma?"", but the girls older brother pulled her closer and shushed her gently. ""Let her continue.""

A rasping breath, ""...there was a young man, who lived far beyond the mountains, hunting strange game, as he had done, and his father before him. The mountains were the only home he knew. It was the middle of summer, yet seemingly overnight, the sun disappeared and snows began to fall. Winter had come, sudden and colder than the man had ever met before. The wind extinguished his fire and froze the water. Even as he left his camp, seeking a safer shelter, he found that not even wild animals survived the cold, dropping dead never to wake again. In any other weather, the man would have been ecstatic at the find, but here it brought only a sense of desperation. Looking up to the stars, near giving up, he saw a great falcon amongst them...""

Someone threw a new log on the fire, and sparks rose towards the roof, ""...the hunter knew not then whether his fate was to die in that terrible storm, but he followed the bird as it flew. Even as it flew, and the hunter followed, the ground rose and the weather became even colder. Multiple times, he was about to give up, but the sight of the majestic bird spurred him on, surrounded by those same shining stars. Weary, cold and starved they finally reached the very tops of the mountain, and the young man was stunned by awe. A great land stretched beyond, green and yet untouched by the claws of winter. The great **falcon** fell from the sky, deathly tired from its long flight towards warmth, but the hunter, despite also being on the brink, knew to save the bird that had faithfully led him to safety, feeding it and carrying it with him down into the warmth of the valley.""

Wide-eyed, the girl asked, ""What happened after that Oma? What happened?""

Smiling, the old woman replied, ""Now, little one, now, get some sleep, we will continue this story tomorrow.""

---

###Serengrys

The [lands](https://i.imgur.com/L5bfY83.png) inhabited by the Serengri lie along the southern edge of Tritoneas forested mountain range. The forested land is perfused by rivers and streams flowing from the mountains into the lands below. These serve not only as a source of sustenance in the form of fish and fresh water, but also as avenues of travel by canoe, connecting the sparsely settled Serengri people.

###Livelihood

The Serengri live fairly spread out, finding sustenance from a multitude of different sources, largely hunting animals and gathering plants & **herbs**. This is usually supplemented by either herding or wild-rice agriculture and fishing along the rivers. However, in drier areas farther from the rivers it became necessary to use some **basic irrigation** systems in order for the rice to survive. In this small-scale agriculture, **sickles** have served as an important tool.

During winter months, grains, **smoke cured** fish and meats provide a steady diet, whilst the Serengri can hide away in their earth & wood homes built by mallet & **shovel** to make crafts out of wood, **tanned** hides and other materials at their disposal.

###Society & Culture

Most Serengri live in relatively isolated settlements up to a handful of families - related by blood related to the matron - the eldest wedded woman. Inheritance and management of these multi-generational lands and settlements hence follows matrilineally. A clan can consist of roughly a dozen such settlements, tied together by marriages, where the husband of the most prosperous matron is considered the leader, representing the clan in political and diplomatic matters.

There are also a few larger settlements, having grown into existence due to their importance as minor trade hubs - tying the local region together and serving as gathering spots to mediate disputes and for the annual autumn festivals. Here, a law-giver, chosen by ""vote"" from amongst the local clan leaders, oversees matters of commerce, order and conflict.

When seeking courtship a young man must prove themselves worthy of the hand of a woman, showing that he can provide for her. This can come in many forms, such as being a craftsman or trader, through a dowry from his family, thus securing an alliance or by constructing a new homestead at an existing settlement or new location.

As such, it is not uncommon to find young men setting out with little more than a **backpack** and some tools to break a new plot of land and prove themselves worthy of the woman they are courting. So far, this has worked quite well with the sparse populous and a declining reliance on hunter-gatherer methods, but whether it is sustainable is yet to be seen.

####Tech

**Regional Package:** Tritonea

**Key technology:** Tanning

**Major technologies:** Herbalism, Basic Irrigation

**Minor technologies:** Sickle, Falconry, Shovels, Backpacks, Smoke Curing"
4ea6i8,https://www.reddit.com/r/DawnPowers/comments/4ea6i8/travelling_north/,2016-04-11 10:43:12 UTC,DawnPowers,0,Travelling North,/r/DawnPowers/comments/4ea6i8/travelling_north/,"As time passed, our relations to the north came to a grinding halt. The northeners had very little to offer, and we had very little to give. Yet there still were those, who believed that riches could be found, in the far north. It was this enthusiasm, together with a determination from the part of the government, to expand the known frontier, to expand the world.

Thus a party set out, on ship, loaded with valuables, and supplies, the ships flying the Aquitinian colours. The ships would be travelling north, taking care to visit all previously encountered civilisations, and to find new ones.

---

Two large Gableboats sail from Mifurdania, visiting all countries, following the coast northwards (eventually leaving known seas), they even visit Tenebrae."
48u8eq,https://www.reddit.com/r/DawnPowers/comments/48u8eq/the_aquitinian_counteraggression_1500_bce/,2016-03-03 21:57:07 UTC,DawnPowers,0,The Aquitinian Counter-Aggression [1500 BCE],/r/DawnPowers/comments/48u8eq/the_aquitinian_counteraggression_1500_bce/,"""*Aqlada! The hegemony will stand by our side*""

""*Good, then send the order...*""

---
**In Telebra, a week later, a sleek felucca with the Aquitinian flag brandished docks in the harbor, a courier runs from the ship, and finds the nearest person of importance.**

""*Bring this swiftly to the leader of your people*"" he says, leaving the parchment, branded with the sigil of the Aqlada. He soon runs off, and the felucca is nowhere to be seen.

Upon reading the message, the emperor saw the following message (written clearly, in his own language).

*As you receive this message Aquitinian soldiers are marching upon Gailunda, and  war is at hand. As we now support the hegemony in their cause. An [Agreement with Tao-Lei](https://www.reddit.com/r/DawnPowers/comments/47r4rk/the_end_of_the_beginning/?ref=search_posts) has been made, and thus we now have no other alternative, but to fight.*

---

**As the messenger left Aqqo, word was sent to the Aquitinian soldiers of the coast of Hooshomon, they then landed in the Aquitinian villages of Hooshomon, and the ships soon left, to bring further soldiers. A force of 200 Aquitinian Veterans followed by another 80 local volunteers (that were soon given proper gear and battle training) soon stood outside the gates (I presume the city has a wall) of Gailunda.**

The inhabitants of the province hardly noticed the change, as the Aquitinian armies neither plundered, nor burned, and word soon got out that these people would get their own chance to affect their situation, if they supported the Aquitinian cause.

---

* 200 Aquitinian veterans arrive in Hooshomon

* 80 local volunteers (from the Aquitinian villages), soon armed, and starting training.

* 200 Aquitinian soldiers arriving the following week, well geared and trained, lacking battle experience.

* Another 400 soldiers will be arriving the following month, well geared and trained, lacking battle experience.

* Number of soldiers come from [here](https://www.reddit.com/r/DawnPowers/comments/47dx94/a_murder_in_the_night/)."
4dhpg4,https://www.reddit.com/r/DawnPowers/comments/4dhpg4/the_beginning_of_the_end/,2016-04-05 18:14:52 UTC,DawnPowers,0,The Beginning of the End,/r/DawnPowers/comments/4dhpg4/the_beginning_of_the_end/,"We left off [here](https://www.reddit.com/r/DawnPowers/comments/4dh58w/hidden_in_plain_sight/)

---

As time went on, the merchants not only took our politicians, they also took our means of ruling our country. Bribes were common talk, and nobody voted anymore, it was pointless. We didn’t realize the consequences of this, until it was far too late to do anything about it. The merchants had entrenched their positions all over society, shutting us out. We felt powerless.

Then HE came, it was obvious from the beginning, he was a born leader, knew his way into the hearts of men. HE told us that we could still save our country, from the greed of others, that HE would show us the way. At first, we simply shouted out our complaints, for everyone to hear, but they wouldn’t listen. 

We didn’t realize at first, but the Kazern was absent, they didn’t care. When previous attempts to get their attention failed, many resorted to violence. They wouldn’t have any of that, the Kazern soon declared a state of emergency, bringing the military into the city. They silenced us, they cut out our tongues. 

Even a mute can change the world, HE showed us, HE gave us arms to defend ourselves. The watches were relentless, the Head wanted them so, he wanted to keep us frightened, he wanted to keep us lame. We left the city, we left their watchful eye, just as HE wanted, we weren’t leaving, we were coming back.

---

As we arrived at Zeqlan, we set up our camp. There were many thousands of us, some soldiers, most civilians. We were armed with what could be found, assembled from all over Mandar, hoping for a new beginning, to this terrible end. HE had not only planted the idea, but also given us the means to fulfill the dream.

HIS destiny was ours, we had made it so, we were all prepared, for the struggle to come."
