id,permalink,date,subreddit,gildings,title,url,body
5p5al5,https://www.reddit.com/r/DawnPowers/comments/5p5al5/claim_the_ainuri/,2017-01-20 17:35:47 UTC,DawnPowers,0,[Claim] The Ainuri,/r/DawnPowers/comments/5p5al5/claim_the_ainuri/,"*The Substance of the World was created by the Spirits, each one made their contribution. A forest Spirit made his little meadow, a Spirit of the water made the small stream through it.*

*Some Spirits were however greater than the others. A roaring river was larger than a trickling stream, the same way the never ending ocean was larger than the sea. Thus, the world had come to be.*

*Who created the Spirits?* **The World did.** 

*Who created life?* **The very same.**

*Who created the world?*

---

There are many Spirits, Good and Evil, Large and Small. We cannot please them all, so we keep to the few around Us. We ignore the rest, and they mostly ignore Us.



The noteworthy Spirits of our lands are several. 

Those of the Land are Námala, of the middle land, Menáo, of the northern land, and Orén, of the southern land.

The Twin River Spirits are Eyómra and Déon, bringing a never ending supply of fish, water and life to Us.

Then, there is Ulmo, the Spirit of the Ocean, stretching to all the corners of the World, bringing food and prosperity to Us.

Of course, one should always spare a thought for your *friendly* neighborhood Spirits, but one should never forget the above listed. Those make up the foundation of our society, the foundation of our lives.

---

The boat creaked as the waves pounded against its sides. The net was full, the evening ripe. He headed back up the river, to the place that he, and many of his fellow Ainúri called home.

---


**Tech**

Primarily **Maritime**

Secondary **Agriculture**

[Tech Sheet](https://docs.google.com/spreadsheets/d/1Ps_G5fxDuv9HkGH84rkrFt-ZgQ5Rggh6RHsvcVLUNEo/edit?usp=sharing)


[The lands of the Ainúri](http://imgur.com/a/QJYp7)"
63cnb7,https://www.reddit.com/r/IronThronePowers/comments/63cnb7/event_wandering_about_brightwater_keep/,2017-04-04 07:12:31 UTC,IronThronePowers,0,[Event] Wandering about Brightwater keep,/r/IronThronePowers/comments/63cnb7/event_wandering_about_brightwater_keep/,"[This was in the 6th month]

Ten days had gone since the accident. Arlan and Oswin had been taking care of the Foss Knight. His collar bone had noticably started to heal, but he had yet to stir from his endless sleep. He had had the occasional visitor from amongst the residents of the keep. Thus, Arlan had gotten to know most of the Ball family. Mostly, they had only come to watch, and had exchanged a cautious ""Hello"" with the two that watched the sleeper.

Today however, Arlan left his post. He had decided to check out Brightwater Keep, the home of the not-so-round and not-so-bouncy Balls. So, he started to explore. There was some activity in the hall at this time, a few kf the very-late sleepers still eating breakfast. Arlan walked up to them, and took a seat. ""Good morning"""
6dqn6e,https://www.reddit.com/r/IronThronePowers/comments/6dqn6e/event_sht_happens/,2017-05-27 23:11:41 UTC,IronThronePowers,0,[Event] Sh*t happens,/r/IronThronePowers/comments/6dqn6e/event_sht_happens/,"On a day in the fifth month of the year 335AC a swarm of ravens leaves the Tyrell camp of the Lord Paramount. One of these ravens flutters away, and lands in the Castle of New Barrel. In this castle a Lord, still drunk from and with the sadness of his wifes passing climbs the stairs to the maesters quarters to read the letter that this raven carried. He did so, and as he began to rush down the stairs to inform the rest on the matter, war was on them all.

Yet, Lord Addam slipped. It took him a mere moment longer to react, but it was already too late. His drunken self began to tumble down the stairs, pain shooting through his body as they hit him. He took to the air for a moment longer, and came down head-first at an awkward angle. He could feel the bone crunch as it snapped, the resistance lessening as his life flashed before his eyes, all the good, and the bad moments, the happy and the sad. He saw the face of Aemma, the woman he had loved. He saw the face of the woman he had cared for, concerned with a sadness she could never feel. The faces of his children passed by, all sad. Then it all went black, it all ended.

--- 

Adelayde was the first to come, the first to see the youngest of her brothers pounding its fists into the slumped body of her father, shrieking and demanding he wake up. Somewhere, in the back of her mind she already knew he wouldn't return, yet all the same she dragged the little freak kicking and sprawling away from Addam, from her father. As one of the nearby servants took care of the thing that had killed her mother, it dawned clearly on her that he was not returning. She cried.

---

[This is mainly lore, but also the heading for some other happenings in other places.]"
59aln3,https://www.reddit.com/r/IronThronePowers/comments/59aln3/event_please_stay_mommy/,2016-10-25 11:54:32 UTC,IronThronePowers,0,[Event] Please stay mommy,/r/IronThronePowers/comments/59aln3/event_please_stay_mommy/,"This time mom had been away longer, nearly a **whole month**. Arlan was becoming anxious and unhappy as he missed his mother, and when she finally returned to New Barrel, Arlan rushed to meet her.

He gave Ceryse a firm hug and didn't let go."
5u77yb,https://www.reddit.com/r/DawnPowers/comments/5u77yb/time_flies/,2017-02-15 13:06:02 UTC,DawnPowers,0,Time Flies,/r/DawnPowers/comments/5u77yb/time_flies/,"Children are born, they grow, they live and old people die. Time goes on and the world lives on. Such is the nature of the universe. As far as the Ainúri were concerned, room was not an issue, space was infinite. Thus, the territory encompassed by their folk [grew](http://imgur.com/a/5IolS).

The coast was their land, and the land between the rivers would be theirs too. Such was the nature of things. 

They smiled, feasted talked and worked. They built, they traveled and they explored. Such was the nature of things."
7oa61h,https://www.reddit.com/r/shadowchargen/comments/7oa61h/lovisa_loki_gripheim_sleaze_technomancer/,2018-01-05 09:31:57 UTC,shadowchargen,0,"Lovisa ""Loki"" Gripheim [Sleaze Technomancer]",/r/shadowchargen/comments/7oa61h/lovisa_loki_gripheim_sleaze_technomancer/,"[PDF & Chummer sheet](https://drive.google.com/open?id=19vuBE7k-HmsSA4QXLxMzk06yw588Nk-L) (Google Drive)

###Priorities

* Meta E

* Attributes B

* Resonance A

* Skills B

* Resources E

###The Three Questions

**My Character is** a technomancer from Sweden, Gothenburg that has grown up in a corporate family and surrounded by tech. She was one of the first to experience the new wireless matrix when it launched, as the Wireless Matrix Initiative came there first. She delved into hacking due to her curiosity and boredness and got tracked after her first proper run. She fled to Seattle to start over, without the local corporates making her life hell. Loki is quite curious and likes to explore new things all the time. This is one of the reasons she has turned to shadowrunning, there are always new and exciting things happening.

**Lokis goals** are first and foremost to explore the matrix, get to know the world and meet new and interesting people. Then, if it is possible later on to get some revenge on those who forced her to flee. Money is of course a nice addition.

**I want to play Loki** to get into the world of Shadowrun, I have Gm:d it IRL (very little) as I am quite interested in it. I'd also like to get the chance to roleplay more, since I enjoy it a lot.
"
599v15,https://www.reddit.com/r/IronThronePowers/comments/599v15/lore_arlan_my_boy/,2016-10-25 07:47:56 UTC,IronThronePowers,0,"[Lore] Arlan, my boy",/r/IronThronePowers/comments/599v15/lore_arlan_my_boy/,"Arlan was a lively boy, quite bright just like myself. I have come to now him very well in the last few months, spending nearly all my free time in his company. He is getting along with both his bastard brothers, playing at duels with Othello, and joining both me and Aemund in our discussions with the maester. When he's not playing, he always hangs around me, asking about my different tasks. He is a very inquisitive boy, always finding things out. 

Addam smiled as Arlan stepped up at his side. ""What are you doing gramps? What are those books?"" 

""I'm doing the bookkeeping Arlan. It's about economy, how to handle coin.""

""Can you show me how?""

""Arlan, my boy, have I ever denied you that?""

Arlan gave him a smile, as he started to explain..."
7yqot6,https://www.reddit.com/r/Brink_of_War/comments/7yqot6/diplomacy_a_cold_winter_morning/,2018-02-19 22:12:35 UTC,Brink_of_War,0,[Diplomacy] A cold winter morning,/r/Brink_of_War/comments/7yqot6/diplomacy_a_cold_winter_morning/,"It was a cold winter morning in the Drottningholm Castle. King Oscar rose from his bed, and stepped over to the window. A white cover of snow lay over the entire city, with smoke billowing from the chimneys of houses and factories. He was growing old, he had ruled the nation for thirty years. He gave a sigh, he didn't have the energy nowadays to do all the things he used to. 

Everything was packed and ready to leave, and soon the royal party was at the train station, and a while after that were heading south on rail.

---

Almost two days later, they had arrived in Berlin. There were two carriages dedicated to them and their party. The morning light was just hitting in through the window as the train came to a grinding halt at the station. On board was both the King and the Queen, as well as Crown Prince Gustaf and his wife, Victoria of Baden. The youngest of the princes, Eugen, had tagged along as well, wishing to take the time to visit Berlin once more. In tow were a few servants, as well as the Minister of Foreign affairs of Sweden, [Alfred Lagerheim](https://sv.wikipedia.org/wiki/Alfred_Lagerheim)."
76brq5,https://www.reddit.com/r/svenskpolitik/comments/76brq5/hur_länge_ska_vi_vara_barn/,2017-10-14 12:12:40 UTC,svenskpolitik,0,"Hur länge ska vi vara ""Barn""?",/r/svenskpolitik/comments/76brq5/hur_länge_ska_vi_vara_barn/,[removed]
5xgqvy,https://www.reddit.com/r/DawnPowers/comments/5xgqvy/a_population_boom_and_the_rise_of_agriculture/,2017-03-04 12:47:44 UTC,DawnPowers,0,"A population boom, and the rise of Agriculture",/r/DawnPowers/comments/5xgqvy/a_population_boom_and_the_rise_of_agriculture/,"During the 2nd millenia of the Ainúri, they multiplied, and [spread](http://imgur.com/a/PNtFA). The northern and southern rivers were hotspots for expansion. The watchcamps allowed the Ainúri to expand further, without as much worry for the raiders. If raiders came, they would retreat to the villages, were the majority of the houses, granaries and infrastructure were. Those few who lived outside the villages knew the danger, and either lived far from  the danger zones, or close enough to the safe areas that they could simply... **RUN AWAY!**"
7yq5uq,https://www.reddit.com/r/Brink_of_War/comments/7yq5uq/flavour_a_meeting_on_hotel_continental/,2018-02-19 21:06:36 UTC,Brink_of_War,0,[FLAVOUR] A meeting on hotel Continental,/r/Brink_of_War/comments/7yq5uq/flavour_a_meeting_on_hotel_continental/,"The 19th of January was quite a cold winter day in Sweden, and mostly like all others. One thing did however make it significant in the Swedish world of politics.

On the eve of this day, representatives from three liberal groups, namely the Peoples Party as well as the Bondeska and Friesenska discussion clubs held a meeting in the restaurant of Stockholms hotel Continental. The result of this meeting turned out to be the Liberal Collection Party, a unification of many of the smaller liberal parties in the Swedish parliament. Some say this is but the first change of many to come, in the quite stable landscape of Swedish Politics."
5tlzc3,https://www.reddit.com/r/DawnPowers/comments/5tlzc3/ainúri_learning_4500_bce/,2017-02-12 15:40:22 UTC,DawnPowers,0,Ainúri Learning [4500 BCE],/r/DawnPowers/comments/5tlzc3/ainúri_learning_4500_bce/,"Much had happened in the during the previous centuries. The Ainúri had been subject to raids from their southeastern neighbors, and had subsequently started to surround their settlements with palisades. They had met new people to the north, and learned from them.

###*Diffused Tech*

During the years, the Ainúri encountered several peoples in the surrounding area. Among these were the Valisani, living further up the Déon river. Along with the Valisani, were found some so far [unnamed indigenies](https://www.reddit.com/r/DawnPowers/comments/5r8636/going_up_the_river/) wearing face masks.

From these indigenies we learned of the **Olive**. A fruit nice and oily, tasty when prepared in the appropriate way. These fruits had hard seeds inside, and after some were left outside the village - along with the rest of the waste, they started to grow. Thus, we saw our first olive trees, these bore more olive fruits, which were then similarly replanted.

As the Gedokosza preferred knocking women unconscious and kidnapping these. Something we adopted from the nearby tribe to try to stop it were their facemasks. Concealing our faces made the female fighters harder to discern from their male counterparts.

The southern menace, raiders, rapists and robbers the whole lot. Evil men incapable of anything but violence we thought, but it seems that they have their own techniques and ways of doing things. From them we learned of the **sling**, capable of slinging deadly rocks far and wide. Even though they are not as useful for hunting as the bow, as they bruise the meat, we adopted them to counter the Gedokosza's own slingers, slightly outranging our own archers.

Other things we noticed about the Gedokosza was that they used the sinew of animals to **sew** together larger pieces of skin, making far better clothes. They also used sharp bones to sew. This we adopted, using the skin and bones of seals and fish, to sew together better fitting clothes for our people, but instead of using sinew, we would use linen string made from flax.

###*Innovative Technologies*

In the swamps of the central Ainúri lands, clay was readily available. Simple pottery made for good containers for fresh water, fish, grain and other foods. Thus, their use was universal. The **Pottery Wheel** came as a product of this, among the many potters in the land, one man had the idea, and it spread like wildfire. It revolutionized the art of pottery, making it far easier, and far more efficient.

The Canoe was one of the most versatile watercrafts of the time, capable of quickly traveling up and down the rivers, and to a limited extent travelling on the sea itself. The fact that they were so common made advances in canoebuilding spread quickly, and came once or twice in so long. Thus, the building of **Advanced Canoes** came to be, they could be longer, sturdier and more streamlined. The canoe was one of the most versatile modes of transportation, a group of six paddlers could achieve a speed of three knots on calm waters. And, the team could, due to the lightness of the boat, carry it together with their gear.

Wood rots. Wood burns. Wood dries. This is the nature of wood. In some areas however, materials like mud and clay were available to all, not just the select few who collected it for their pots. One day, one young genius had the idea, as he watched a pot drying in the sun. The pottery doesn't burn, it doesn't rot, and the drying helps it. Thus **Mud Bricks** came to be. They held long for permanent structures, and did not burn when the raiders came. This made them incredibly loved.

The widespread use of pottery and mud bricks made people think. Pots dried in the sun. Why did they dry? The heat of the sun dried them. How could this be made quicker? A fire?  As pots and bricks could not be held above the fire, lest they fall to pieces, one would instead force the heat to stay with them, much the same way one had a fire in his home to warm it. Thus came the **Pit Kiln**, a convenient way to quickly dry larger amounts of pottery and mudwork.

Those who lived by the sea fished fish, and showered themselves in fresh and salt water. The fish however did not last forever, they rotted, they smelled, they became uneatable. One day, a fisher noticed a fish in his boat that had been there for quite a while, it had not rotted. It was lying in a small pool of salt water, so he tried the trick on other fish that he had caught. It worked, his method of **Saline preservation** meant a lot. The people could now securely keep their fish and vegetables for longer periods of time, not only relying on grain for long term food security.

As the populus of the Ainúri territories grew, trade became more and more prevalent. This did however create some disputes. How much grain was a particular salesman selling for a certain amount of fish? There was a simple solution. Measuring the amount that each brought to the bargain. It was however hard to check how much grain a sack contained, so instead one would measure its weight. At first, the unreliable method of testing by hand was used, but this quickly led to anger. Instead, the **Scale** came to be. An easy way of comparing the weight of two objects.

The Ainúri traveled out to sea a lot, to fish mostly. However, if one travelled far out to fish, it could take quite a while to get back, and manuevering a boat in the dark was hard. Instead, people took to checking the time, but a persons sense of time could be unreliable. Instead, the **Sundial** came to be.



[Tech sheet](https://docs.google.com/spreadsheets/d/1Ps_G5fxDuv9HkGH84rkrFt-ZgQ5Rggh6RHsvcVLUNEo/edit?usp=sharing)

[Just FYI, I'll be writing from phone mostly in the coming weeks, so the post will be posted before becoming finished]"
6n9tev,https://www.reddit.com/r/IronThronePowers/comments/6n9tev/event_a_tourney_of_apples/,2017-07-14 15:40:53 UTC,IronThronePowers,0,[Event] A Tourney of Apples,/r/IronThronePowers/comments/6n9tev/event_a_tourney_of_apples/,"As the Ceremony came to an end, the now-married couple proceeded from the great hall. It did not take long to empty once the septon the center of attention had left, and the events now proceeded to the grounds outside, where great tents had been set up for the audience, and the grounds had been prepared for the different competitions. The newlyweds seated themselves in the box, and after a the preparations for the different competitors had been made, the horn went - and the games began!"
5ehtf4,https://www.reddit.com/r/neptunespride/comments/5ehtf4/hi_there_im_new/,2016-11-23 15:23:58 UTC,neptunespride,0,Hi there! I'm new!,/r/neptunespride/comments/5ehtf4/hi_there_im_new/,"Alright, so I was checking out some online games the other day and found ""Neptune's Pride"". Quite nice game if you ask me, but I have 
some questions.

How active is the community? (how often does the general player check in)

Are there any true & proper NOOB mistakes?

Finally - How good is the game?

"
5895wz,https://www.reddit.com/r/IronThronePowers/comments/5895wz/event_a_solemn_ceremony/,2016-10-19 08:00:39 UTC,IronThronePowers,0,[Event] A Solemn Ceremony,/r/IronThronePowers/comments/5895wz/event_a_solemn_ceremony/,"After the guests had been recieved in New Barrel, the procession headed to the Sept. There Ser Raynald is lying upon the altar, clothed in the colors of the Fossoways, green on yellow. The funeral stones on his eyes, a sword clasped in his hands. The Stranger looming behind him. Seven vases placed at his feet.

Lord Addam had held vigil the last few nights. His face looked old, tired, and sad.

He was the first to give his respects, and would be the last to leave his sons side. His wife Ceryse and his son Arlan followed after him. He had made sure that Othello and Aemund had the chance to say goodbye to their father - before the guests came."
5cqptj,https://www.reddit.com/r/IronThronePowers/comments/5cqptj/event_the_frozen_apples_wedding/,2016-11-13 16:42:05 UTC,IronThronePowers,0,[Event] The Frozen Apples Wedding,/r/IronThronePowers/comments/5cqptj/event_the_frozen_apples_wedding/,"[Short version]

Wedding, food and bedding. All that nice jazz.

[Long version]

###Pre-Wedding Lore

There were lots of new people in New Barrel, many kids around, Addam was quite certain that Arlan had lots of good company, but he made sure to have Martyn keep an eye out anyways. He himself was getting ready for his impending wedding.

Addam donned his finest clothes for the occasion, his face cleanly shaven, except for the small beard on his chin. He checked himself in the mirror, and smiled.

That morning, the wedding breakfast had been held. Nothing too big, nothing too dramatic, some gifts had come his way. Most had enjoyed the meal, the mulled wine had warmed them all up, while bacon and eggs had settled in their stomachs. Lots of jokes had been going around the table, the men laughing and having fun. He had also heard that the women's breakfast had been enjoyable.

Everything had been arranged, the ceremony, the feast, and the celebrations. All in all it was an expensive affair, but he had been feeling generous. He had been saving up a good amount of gold, and piles of money were never of any help to anyone. The food would be splendid, he knew.

Everything was ready, everything was done. He headed to the sept.

##The Wedding

This wasn't his first time marrying, but it had been a long time. He was dressed in the finest of clothes, with the [Green and Yellow](https://www.youtube.com/watch?v=D1UYuAr4Ng0) of house Fossoway. He soon took his place at the front of the sept, standing between the mother and father, the septon with him. The rows were filled with people, both high and low. The Lords and Ladies settled toward the front, with the gentry towards the back and some out in the cold beyond the doors of the sept.

As musicians started playing, Sheia Fossoway, the Bride was slowly coming towards the altar. She was a beautiful young lady, and his own hair was beginning to gray. Nevertheless, they were about to be wedded. A cold breeze caught in her maidens cloak, and it lifted slightly, before once more settling about her.

A smile was on her face, whether real or not, he would not worry about. Her escort consisted of Grance, the Lord of Cider Hall, as well as her father. 

The septon said the holy words, and before long they were exchanging their vows, his voice, one of a Lord: ""*I am hers, and she is mine. From this day, until the end of my days.*"" and hers, one of Beauty... ""*I am his, and he is mine. From this day, until the end of my days.*""

The septon was happy, all the incantations and recitals had been fulfilled. He cleared his voice and called out loudly: ""From this moment forward, Addam and Sheia of House Fossoway are declared husband and wife. Their vows declared in front of Gods and men, may their union endure beyond such time as the oceans swallow the land, and the stars rain down from the heavens.""

He unfastened the ceremonial cloak, yellow, with a green apple and draped it over her shoulders. It was not all that different from her maidens cloak, the only difference being the color of the apple.

And now it was time to ""Kiss the bride"" he embraced Sheia and gave her an affectionante kiss. He knew he would never be the man of her dreams, but he was a good man, and he would be a good husband. He made sure she would like the kiss, he had some skill in the art of kissing.

###The Feast

The Great Hall of New Barrel was filled to the brim, a loud din of talking and laughter blanketed the air. Servants started flowing into the hall, with steaming dishes of lamb, venison and other tasty foods on the plates. Not only were there stews and roots, but also sweet breads many different sorts. Every man and woman could have their fill of New Barrel Cider, but there was also arbour red and several mulled wines to heat up the conversations. For dessert there were pies, lots of pies, dates and different arrangements of exotic fruits. There was however one last dish, Frozen apples in steaming whipped cream with a taste of vanilla. And so, the feast began.
"
