id,permalink,date,subreddit,gildings,title,url,body
8e6lit,https://www.reddit.com/r/SWARJE/comments/8e6lit/knugen/,2018-04-22 22:05:21 UTC,SWARJE,0,Knugen,https://www.reddit.com/r/photoshopbattles/comments/8e2gtv/psbattle_the_swedish_king/,
ap9811,https://www.reddit.com/r/SevenKingdoms/comments/ap9811/event_the_long_night_before_rising/,2019-02-10 22:22:37 UTC,SevenKingdoms,0,[Event] The Long Night before Rising,/r/SevenKingdoms/comments/ap9811/event_the_long_night_before_rising/,"Damon had squired and trained for many years, first under his Great-Uncle, and then under Ser Edric. It made him think of his elder brother, and he felt a small tug in his heart as he recalled his warm goodbye before they had fled Horn Hill. Before they had fled home. He still remembered it like yesterday.

He waited as Edric donned his armour and sword, the old knight that had been his teacher during their years in exile. He smiled a little, recalling their many training sessions and sparrings. Unlike Edric, he would wear a simple white garb, and his vigil would extend through the night. He gave his sister a big hug, and one to his cousin as well. ""Good luck"", they told him, smiling.

It was afternoon when they reached the sept of Baelor, he did not know much of what would happen, but he was tingling with excitement. Something that his teacher knew would wear off quite soon."
eokzjg,https://www.reddit.com/r/SWWP/comments/eokzjg/politics_epic_rap_battles_of_althistory_emil/,2020-01-14 13:03:01 UTC,SWWP,0,[Politics] Epic Rap battles of alt-history: Emil Stang vs. Oscar Torp,/r/SWWP/comments/eokzjg/politics_epic_rap_battles_of_althistory_emil/,"The prime minister of Norway, Kyrre Grepp, is sick wich tuberculosis, and seems to be getting worse by the day. While he had taken his party in the direction of joining the internationale, he did not have time to do so before tuberculosis struck. After being out of office for more than a month, the vultures have begun to circle. There are two candidates within Arbeiderpartiet and Landsorganisasjonen (LO, the norwegian unions) for his succession.

The first is Emil Stang, a member of the revolutionary branch of the party, set on continuing the party's path into the komintern and bringing soviet socialism to Norway. During previous years, he has already spent some time in Soviet Russia, where his beliefs have been strengthened. While his support is large in the upper echelons of the party, his radical ideas haven't garnered as much popularity in the lower ranks.

Second is Oscar Torp, grown up in Østfold, one of the strongest popular seats of Arbeiderpartiet. He has a seat on the party leadership council, as well as the loyalty of most of the less populated northern party districts, much of his influence stemming from his leadership of the Sarpsborg district.

Even as the succession crisis begins, other members of upper Norwegian society watch in horror and begin to make contingency plans."
a0o0m9,https://www.reddit.com/r/SevenKingdoms/comments/a0o0m9/claim_house_tarly_of_horn_hill/,2018-11-26 21:54:42 UTC,SevenKingdoms,0,[Claim] House Tarly of Horn Hill,/r/SevenKingdoms/comments/a0o0m9/claim_house_tarly_of_horn_hill/,"~~I'm placing a placeholder claim post right now, filling out the details in the morning! Goodnight to y'all!~~

##House Tarly of Horn Hill

House Tarlys is a minor house with a great history, a house of marcher Lord's that have been the great bastion against foreign Invaders from the south (ehem Dorne). Even though the house has been through some hardships in recent years, Lady Ellyn has finally reached maturity, and is ready to take the mantle of her forebearers. Which direction the house will head is unclear, but it most definitely will be an interesting read.

###The Family

* **Lady Ellyn**, 23 years old, is the current head of the family is a fair young Lady in her finest years. She has a lot ahead of her, and a lot is at stake for her and her house. While she was quite insecure in her teens, she has had a bit of time to grow into the confidence and maturity of the Lordship. Her marriage to Roger Tyrell is one that brings with it the support and connections of the Paramount house, some within the family have however not forgotten what befell the late Lord Samwyle, and his father before him. 

* Miss **Alayne Tarly**, 20 years old, is the younger sister of the Lady. She was very much a forgotten younger sibling, having lived nearly her entire life in the general vicinity of Horn Hill. Unlike her elder sister whom was destined for Ladyhood and wardened with the Ashford, she was raised at home. It was her widowed mother Bethany who was supposed to take responsibility for her upbringing, but she was never quite the same since the beheading of her late husband. Thus is had fallen to her Great-Uncle Hectyr to take care of her. He did his best, bless him, with the help of Alayne's aunt-in-law Eleanor, who might not have had the best of influences on the young girl.

*  Lady **Bethany Tarly neé Ball**, 47 years old, is the widow of the late Lord Samwyle. She never quite recovered after his beheading, and has been somewhat distant ever since, sometimes bursting into action, sometimes crumbling under the weight of her emotions. Needless to say, it rendered her role in Alayne's upbringing, and the ruling of the house minimal. She firmly dislikes the husband of her daughter, as his presence brings back uncomfortable memories of past events.


* Great-Uncle **Hectyr Tarly**, 63 years old, was for a long time the de-facto regent of the house, and even though his brothers granddaughter now officially has taken her seat as Lady, he holds a quite measurable amount of influence, especially with the vassals of the house. Despite his age, he is still has an air of seriousness about him, something he carried home from his days in Essos. He is well aware that his time on this Earth is running out, but that will not stop him from passing on his mission for vengeance.

* Uncle **Clifford Tarly**, 42 years old, was the Lord Regent of Horn Hill for a long time, but never had any real power in the house. He is a man content to live life as it comes, daydreaming and thinking. Some think him a bit queer, and he has always had quite peculiar tendencies. Married to Eleanor Selmy but never truly settled.

* Aunt-in-law **Eleanor Tarly neé Selmy**, 42 years old, a woman of passion and action stuck in a castle less exciting than the smallfolks village nearby. She has dragged her reluctant husband to countless weddings, tournaments and feasts, and rumor has it even attended some without him. She and her husband have four children, two sons and two daughters. **Leo**, sixteen years of age is the eldest son. Having grown up under the supervision of Hectyr, he has gotten rigorous training with both sword and shield, and is becoming quite a good fighter.  The second sibling, **Delena Tarly**, is but a year younger than her elder brother, and has grown up with her cousins as role models, but with heavy influence from Hectyr. Next is **Damon Tarly**, twelve years old. Being the younger of the two, he is also quite a bit more mischievous.  Youngest of the siblings is **Cecilia Tarly**, a mere five years of age, quite a bit younger than the other siblings. She does however seem quite likeable.

"
dn3n5e,https://www.reddit.com/r/SevenKingdoms/comments/dn3n5e/event_the_paintress_banquet_art_auction/,2019-10-25 20:53:04 UTC,SevenKingdoms,0,[Event] The Paintress Banquet: Art Auction,/r/SevenKingdoms/comments/dn3n5e/event_the_paintress_banquet_art_auction/,"As the evening at the Evenstar Manse was coming to a close and the desserts were being served, the tone in the great hall shifted.

The music was toned down, more torches were lit around the stage, chairs were placed close to the stage, and bidding signs were handed out to those present.

The spokesperson that had begun the evening appeared once more on stage. ""Ladies and Gentlemen! The time has come for the height of the night, the auction!"", he gave the audience a deep bow. Upon the stage was now a stand with an auctioneers hammer whence the presenter moved, as well as the [five canvas stands](https://www.reddit.com/r/SevenKingdoms/comments/djm0sr/event_the_paintress_banquet_at_the_evenstar_manse/f4uivgt?utm_medium=android_app&utm_source=share) that had been on display the entire evening.

""After the paintings have been auctioned, the *mystery object*"", the auctioneer geatured towards the empty canvas stand, ""Will be auctioned as well."""
804kc3,https://www.reddit.com/r/RimWorld/comments/804kc3/my_caravan_food_went_poof/,2018-02-25 13:55:33 UTC,RimWorld,0,My caravan food went *poof*,/r/RimWorld/comments/804kc3/my_caravan_food_went_poof/,"So I am playing this sea ice playthrough, and there showed up an item stash about seven days away over the sea ice. So I had some luck earlier and managed to murder an entire herd of muffalo, I have plenty of food. I proceed to make 45 simple meals since the minus degrees means they won't spoil. Two of my colonists are on their merry way with what was supposed to be 20 days of food for a 14 day trip. Less than 6 days into their trip and they are out. Help pls!

[pics](https://imgur.com/a/XDVdq)"
f3u4vd,https://www.reddit.com/r/ColdWarPowers/comments/f3u4vd/propaganda_excerpt_from_a_transmission_by_alquds/,2020-02-14 15:57:24 UTC,ColdWarPowers,0,"[PROPAGANDA] Excerpt from a transmission by Al-Quds Radio, 1951",/r/ColdWarPowers/comments/f3u4vd/propaganda_excerpt_from_a_transmission_by_alquds/,">""It is with heavy heart that I speak to you all today. The liberation of Syria began less than a month ago, but even as our brave countrymen worked to free our Syrian brethren from the tyranny of the SSNP, the Turks showed their true colors, marching to support the Socialist regime, and assert their dominance over our Arab brethren. This was unexpected, since we thought they had long ago abandoned the Ottoman ambitions that we crushed a little over thirty years ago, and in turn earned us our independence. The SSNP has robbed our Syrian brothers of their Arab culture and heritage, and it is our duty to end their heinous deeds...""

>-King Abdullah I speaking in Al-Quds Radio"
atlng9,https://www.reddit.com/r/SevenKingdoms/comments/atlng9/event_courier_arriving_to_old_oak/,2019-02-22 19:22:32 UTC,SevenKingdoms,0,[Event] Courier arriving to Old Oak,/r/SevenKingdoms/comments/atlng9/event_courier_arriving_to_old_oak/,"[This was originally supposed to have happened quite a while ago but delays happened]

A courier comes riding at a brisk pace up to the gate of Old Oak. He seems to be carrying a letter, and upon his surcoat is a pin with the Tarly Huntsman."
aa3ful,https://www.reddit.com/r/SevenKingdoms/comments/aa3ful/event_tardy_tarly/,2018-12-27 21:30:23 UTC,SevenKingdoms,0,[Event] Tardy Tarly,/r/SevenKingdoms/comments/aa3ful/event_tardy_tarly/,"Ser Hunt and his detachment of cavalry arrived at Horn Hill. Almost three years had passed since they had left on that fateful day, and now he was returning with but a small remainder of his Lady's forces to hold the Hill until her return.

The Tarly banners of the cavalry fluttered in the wind the soldiers started depositing their gear."
f0a0cp,https://www.reddit.com/r/ColdWarPowers/comments/f0a0cp/diplomacy_arab_summit_on_the_palestinian_question/,2020-02-07 12:47:10 UTC,ColdWarPowers,0,"[DIPLOMACY] Arab summit on the Palestinian Question in Amman, October 1950",/r/ColdWarPowers/comments/f0a0cp/diplomacy_arab_summit_on_the_palestinian_question/,"A communique is sent out to all Arab League members and in addition to these Oman, Yemen, Bahrain and Qatar. The communique invites them to a summit in Amman for the purpose of solving the Palestinian Question. Jordan notes that the Haganah militias occupying the western mandate of Palestine will not be invited to any discussions as they have previously shown disinterest in negotiations.

A small number of Palestinian representatives are also invited, >!Hand picked by the Jordanian government from the West Bank.!<

Five main points are to be discussed.

1. The displaced Palestinian civilians. They will need to recieve a new home and be taken care of, as well as citizenship. This is absolutely necessary to prevent instability, and secure the wellbeing of the Palestinian people.

2. Borders and territorial recognition. With the deterioration of the British mandate into chaos, the territory has now come under contention. The Arab world needs to agree on new De Jure areas of government.

3. A joint effort to take care of those who have been affected by the war.

4. Protection against future instability in the Levant region, most notably against the illegal government in western Palestine."
pz4nb6,https://www.reddit.com/r/WeltkriegPowers/comments/pz4nb6/event_open_rp_panam_auction_tickets_on_the_first/,2021-10-01 09:47:12 UTC,WeltkriegPowers,0,[EVENT] (Open RP) PanAm Auction - Tickets on the first commercial Transpacific Flight!,/r/WeltkriegPowers/comments/pz4nb6/event_open_rp_panam_auction_tickets_on_the_first/,"The Pan-American Hawaiian Clipper has been flying its mail service across the pacific since early 1935, utilizing the Dole Airport in Honolulu as a stopover for its stations in Midway, Guam and Canton. But now, we will be opening the first [trans-pacific passenger air route](https://i.pinimg.com/originals/78/d7/0e/78d70e1b3d9fc3d3e35a04cc504b1320.jpg).

The aircraft servicing the line is of the model [Martin M-130](https://en.wikipedia.org/wiki/Martin_M-130). A state of the art clipper featuring a passenger capacity of forty-six, propelled by four eight hundred horsepower engines and capable of completing the ten-thousand kilometer journey from San Francisco to Shanghai in just three days.

Thus, we are proud to announce that the remaining twelve tickets for the first Trans-pacific passenger flight scheduled for June will be sold at auction, four of these in New York, four in San Francisco and four in Berlin. The starting price will be 1'500 United States Dollars or 6'000 Reichsmarks. The other twelve tickets were pre-purchased in some cases years earlier by aviation enthusiasts that wanted to see the trans-pacific project become a reality.

Included in this is complete service aboard the aircraft by our PanAm staff as well as tours in Honolulu and Shanghai. Further details are available upon request.

*At Pan Am, the sky is no longer the limit.*

*/The System of the Flying Clippers.*

---

[M] Do you have any eccentric millionaires interested in flying? Have them book tickets for them and their family!"
i7s26d,https://www.reddit.com/r/WeltkriegPowers/comments/i7s26d/event_a_most_heinous_act_of_villainy_and_massacre/,2020-08-11 13:43:39 UTC,WeltkriegPowers,0,[Event] A most heinous act of villainy and massacre,/r/WeltkriegPowers/comments/i7s26d/event_a_most_heinous_act_of_villainy_and_massacre/,"As the day wore on, it became apparent that what was thought to be a prelude to a war was not. It was a heinous act of horrible massacre, yet only that. Not even the Stockholm Bloodbath over five hundred years ago, had been as bloody as this. Almost three and a half hours had gone before the all-clear signal - a ninety second long steady tone - was sounded across the country, yet even so, the army remained on high alert.

&nbsp;

One hundred and thirty-seven members of parliament had been brutally murdered, along with many more in the service staff as well as many wounded. Among the wounded was the Gösta Bagge - the Prime Minister and the grandson of the King, Prince Gustaf Adolf. 

The Prince had drawn his service weapon, being the only member of parliament permitted to carry one as a member of the Royal Household, Minister of Defence and Major within the Army. He personally had shot dead three of the attackers, taking a bullet to his shoulder in the process. For his bravery, he would be rewarded the [Royal Order of the Seraphim](https://en.wikipedia.org/wiki/Royal_Order_of_the_Seraphim) by the King himself in the hospital, and would reach become a national hero in the eyes of the people.

&nbsp;


The day had not yet come to an end when the gunmen had been tied to the Pan-Aryan league by the Third Branch of the State Police - something that would spark a massive outrage not only from the public, but also the Royal Family. The connection between them and the Pan-German League, an organization sponsored by the German State had been established long ago, and was no secret.

With a majority of the Riksdag out of action as well as the Prime Minister being wounded, and vice killed, the King and the Supreme Commander had taken it upon themselves to restore order. The representatives who had escaped the massacre unscathed - either through sheer luck, or having been somewhere else were all assembled in the courtyard of the royal castle. 

Three motions were proposed and passed, right in that courtyard by unanimous assent from the assembled representatives, even those from the Social Democratic Party.

* An amendment to the constitution allowing the implementation of temporary martial law with assent from at least two of the following legal instances (the King, the Supreme Commander, the Prime Minister and the Riksdag) that would need to be confirmed by the other two instances within two weeks, and mandated to be revisited once per month by the Riksdag.

* The reformation of the Third Branch of the State Police into the Swedish Security Service (Rikspolisstyrelsens säkerhetsavdelning RPS/Säk) as a separate branch of government from both the military and police with their own budget.

* The labelling of the NAL and PGL as terrorist organizations (a new term within swedish law which also received a definition) permitting the arrest and conviction of any member based on the crimes of other members.

&nbsp;

As the evening was drawing near, the King himself made a speech to the Swedish People over radio, only the second time that this happened in Swedish History.

[(In Swedish)](https://youtu.be/K_V8g41bLgo)

""Kära Svenskar, jag har just avslutat ett möte med Rikspolischefen och Överbefälhavaren om förmiddagens attack. Först och främst vill jag säga att mina och kungafamiljens tankar går till offren för detta avskyvärda dåd. Det är våra medmänniskor, våra representanter som dödats och bragts om livet.""

""Vi tänker också på deras familjer och vänner, vi känner också med de i deras sorg och oro. Vi är alla omskakade om det som har hänt. Det är samtidigt hoppfullt att se den omtanke som människor visar varandra och det visar på den här kraften i vårat samhälle. Alla vi som vill hjälpa är många många fler än de som vill oss ont. Den vetskapen ger mig tröst och tillförsikt.""

""Armé, polis, sjukvård och räddningstjänst har gjort ett fantastiskt arbete för att minimera skadeverkningarna. Nu är det viktigt att de får arbeta vidare i lugn, och ro. Sverige är och har länge varit, och skall fortsätta vara ett tryggt och fredligt land.""

""Det är även av denna anledning som jag har gett regeringen i uppdrag att utkräva upprättelse från den Tyska staten och deras kumpaner för denna hemska gärning mot det Svenska folket. Denna dag kommer alltid att kännas i våra hjärtan och det minsta vi kan göra är att ge de som omkommit rättvisa.""

&nbsp;

(In English)

""My fellow Swedes, I have just concluded a meeting with the National Police Chief and the Commander-in-Chief about this morning's attack. First of all, I want to say that my and the royal family's thoughts go to the victims of this heinous act. Those killed are not only our fellow people, but also our representatives.""

""We also think of their families and friends, we feel for them in their grief and worry. We are all shaken by what has happened. At the same time, it is hopeful to see the care that our people show for each other and it shows this immense force in our society. Those of us who want to help are many, many more than those who want to hurt us. That knowledge gives me comfort and confidence. ""

""The army, police, medical and rescue services have done their very best to minimize the harm. Now it is imperative that they be able to continue their work in peace and quiet. Sweden is, has been and will continue to be a safe and peaceful country.""

""It is also for this reason that I havetasked the government with demanding redress from the German state and their accomplices for this horrible deed against the Swedish people. This day will be felt forever in our hearts and the least we can do is give those who have perished justice. ""


&nbsp;

With domestic affairs being taken care of, the eyes of the Swedish People turned with sudden hatred towards the Germans across the sea, those who for so long had pretended to be friends of the Swedish People, only to violate one of their most sacred institutions in the most bloody massacre to have ever occurred in the country..."
hyqps6,https://www.reddit.com/r/WeltkriegPowers/comments/hyqps6/event_vänsterpartiet_syndikalisterna_bröd_för/,2020-07-27 11:41:59 UTC,WeltkriegPowers,0,"[Event] Vänsterpartiet Syndikalisterna - ""Bröd för brödrafolket!""",/r/WeltkriegPowers/comments/hyqps6/event_vänsterpartiet_syndikalisterna_bröd_för/,"Black Monday had hit Sweden hard and the methods Gösta Bagge and his government were using weren't exactly placating the people.  Welfare cuts, subsidies to the companies, army investments, foreign trade agreements. A small subset of the Left Party, calling themselves the Syndicalists, had begun to chant in the streets of factory cities like Stockholm, Gothenburg, Malmö and Norrköping.

 ""Bread for the people!""

Those were the words of hungry, unemployed factory workers. In some circles, there had been talk of blockading the elections, preventing ""The wrong people"" from voting. Needless to say, all this was making certain people worried.

All things considered however, things were starting to recover. Thanks to resource exports and subsidies, mining towns, lumber mills and farmers in the countryside had mostly recovered."
p3md55,https://www.reddit.com/r/ColdWarPowers/comments/p3md55/event_retro_turkish_general_election_of_1946/,2021-08-13 15:00:01 UTC,ColdWarPowers,0,[EVENT] (retro) Turkish general election of 1946,/r/ColdWarPowers/comments/p3md55/event_retro_turkish_general_election_of_1946/,"The year 1946 is an exciting one, particularly in Turkey. The results from the general election have now come in, with particularly high voter turnouts for the ruling CHP and the newly formed DP.

This resulted in several battleground constituencies, many of them being taken by the DP.

---

The results are:

288 seats for the ruling CHP

147 seats for the DP in opposition

30 seats occupied by independents

[Parliament](https://upload.wikimedia.org/wikipedia/commons/6/67/Turkey_Parliament_1946.svg)

---

Overall, the CHP maintains a significant majority, it is however clear that the DP will be able to put up a strong fight for the leadership of the nation in future elections.

President İsmet İnönü will remain, with a new cabinet headed by Recep Peker to aid him. It is up to them now to prove that the CHP is capable of renewal in the face of opposition."
hxltuf,https://www.reddit.com/r/WeltkriegPowers/comments/hxltuf/diplomacy_nordic_conferece_on_black_monday/,2020-07-25 12:20:36 UTC,WeltkriegPowers,0,[Diplomacy] Nordic Conferece on Black Monday,/r/WeltkriegPowers/comments/hxltuf/diplomacy_nordic_conferece_on_black_monday/,"*March, 1936, Stockholm*

The Nordic countries, that being Sweden, Denmark, Norway, Finland as well as an Icelandic representative have met for a conference on a joint Nordic response to Black Monday. There is indeed a German representative there too, but a closed-door discussion will preceed his invitation into the room."
ig6o7h,https://www.reddit.com/r/WeltkriegPowers/comments/ig6o7h/event_branobel_cuts_off_norwegian_oil_supply/,2020-08-25 06:17:01 UTC,WeltkriegPowers,0,[Event] Branobel cuts off Norwegian Oil Supply,/r/WeltkriegPowers/comments/ig6o7h/event_branobel_cuts_off_norwegian_oil_supply/,"**May, 1938**

As the largest supplier of Oil and petroleum products in Europe, Branobel had been the majority supplier of oil to Norway, in addition to owning large amounts of infrastructure such as gas stations and fuel depots. With the socialist revolution, their assets in Norway were seized. Soon after, Branobel informed the syndicalists that their oil supplies to Norway had seized until such a time that reparations for the stolen property was given. They also urged their colleagues in BP, Royal Shell, Exxon and Esso to do the same.

In other news, King Haakon promised several companies that ""At such a time that a legitimate government returns to Norway, all stolen property will be returned to their rightful owners."""
