id,permalink,date,subreddit,gildings,title,url,body
5ih04b,https://www.reddit.com/r/IronThronePowers/comments/5ih04b/lore_awww_shiieeet/,2016-12-15 11:21:26 UTC,IronThronePowers,0,[Lore] Awww Shiieeet,/r/IronThronePowers/comments/5ih04b/lore_awww_shiieeet/,"""Really Nevio? Couldn't you just hold it in a bit longer?""

The baby grinned at its mother

Sheia couldn't help but laugh at that, Nevio was always cute, always funny, and always taking a poop. He seemed to start smelling every half hour or so. 

She loved Nevio with all her heart, but it had become very annoying. He was demanding, and constantly needed someone by his side, day and night. Nevertheless, she had started to return to Addams loving embrace. He loved both her and the child, and they were a happy little family. They had begun riding together through the white apple gardens, she had an apple red mare, elegant and calm. They had also started to train archery together, every morning, she had gotten a lot better with Addams help. There was one other thing that they had done. They had hired an artisan to make a painting of them. In the middle they would both be, but the painting would only be finished once the family was.

She called one of the nannies over, and they changed his diapers.

Addam had been very open with her, showed her a lot of how to manage the holdfast, and she had gotten a hang of it. But the bliss - the bliss of a mother, the love towards a child. It had dominated her feelings the last year. It had always been present, the love towards Nevio, her son.
"
6f9luk,https://www.reddit.com/r/aww/comments/6f9luk/white_ball_of_fluff/,2017-06-04 20:33:05 UTC,aww,0,White Ball of Fluff,http://imgur.com/a/2HRK3,
57a02o,https://www.reddit.com/r/rollme/comments/57a02o/test/,2016-10-13 12:32:23 UTC,rollme,0,test,/r/rollme/comments/57a02o/test/,
57yti9,https://www.reddit.com/r/IronThronePowers/comments/57yti9/letter_permission_to_barrel/,2016-10-17 18:05:54 UTC,IronThronePowers,0,[Letter] Permission to BARREL,/r/IronThronePowers/comments/57yti9/letter_permission_to_barrel/,"Lord Leyton Hightower,

Once again my congratulations to the marriage, it was a fabulous occasion. Now, down to business. I ask for permission to open a company for the exporting of barrels in Oldtown, a successful enterprise could mean a lot to future income.

Many thanks

Lord Addam Fossoway"
69yju0,https://www.reddit.com/r/IronThronePowers/comments/69yju0/event_visiting_the_highgarden_steward/,2017-05-08 14:52:22 UTC,IronThronePowers,0,[Event] Visiting the Highgarden steward,/r/IronThronePowers/comments/69yju0/event_visiting_the_highgarden_steward/,"It was the 12th month, and Addam had traveled the short stretch of road to Highgarden. It was time to meet the Steward of Highgarden. His horse clippety-clopped through the gates, and he went to find the man who he was supposed to meet. The time had finally come for the project to begin, and this was the first step.

A little while later, there was a knock on Horatios door. ""May I enter?"""
6f9jss,https://www.reddit.com/r/aww/comments/6f9jss/white_ball_of_fluff/,2017-06-04 20:23:07 UTC,aww,0,White Ball of Fluff,http://i.imgur.com/6yN0Bys.jpg,
5x2gve,https://www.reddit.com/r/DawnPowers/comments/5x2gve/death_to_the_evil_southerners/,2017-03-02 10:18:22 UTC,DawnPowers,0,Death to the Evil Southerners,/r/DawnPowers/comments/5x2gve/death_to_the_evil_southerners/,"With the general introduction of palisaded villages in 4300 Bce, the larger villages became almost impossible to siege with archers raining hell down on any raider that even dared to approach it. However, as time passed they not only defended the villages, but all sightings of these raiders were reported and every so often a large, organized party of militia would flow from a meeting point to make short work of the raiders. 

Thus led to a fierce reputation spreading of the Ainúri. They defended themselves - harshly and with great force. At a gathering of village heads it was decided that small watchcamps would be set up, so any incoming raiders would be detected. With time, the south finally started to expand again, the line of watch moving ever to the southeast."
6a7x0t,https://www.reddit.com/r/IronThronePowers/comments/6a7x0t/letter_unfortunate_circumstances/,2017-05-09 20:08:50 UTC,IronThronePowers,0,[Letter] Unfortunate circumstances,/r/IronThronePowers/comments/6a7x0t/letter_unfortunate_circumstances/,"The following letter is sent to all reachholds, except those who get special ones. This occurs early in the 1st month.

>Dear [Lord/Lady/Corpse] of [Holdfast/City/Tomb]

>Last month my beloved wife Sheia left the world. You are hereby invited to her funeral at New Barrel. It will be a great relief to share the burden with all of you who come. The funeral will be held early in the 2nd month for you all to attend.

>Much Sorrow

>Lord Addam Fossoway of New Barrel

---

The following letter is sent to Cider Hall

>Lord Grance  

>It grieves me to say that your, my beautiful wife Lady Sheia passed away in childbirth late in the previous month. You are invited to come visit for her funeral, which will be held early in the next month. It is my hope at least that we will help each others ease the sorrow of her passing.



>Lord Addam

---

This letter arrives to Ashford Castle

>Lord Jon Ashford

>During the end of the previous year, my wife dearest, Sheia, passed away in childbirth. Early in the coming month, her ceremony will be held. I am sure that both Arlan and Othello want to come, and it is my hope that you do too. If you are tied up, it shall not disturb you, but these are the times when friends are truly needed.

>Lord Addam Fossoway"
5inlyn,https://www.reddit.com/r/IronThronePowers/comments/5inlyn/lore_a_rude_awakening/,2016-12-16 10:37:32 UTC,IronThronePowers,0,[Lore] A Rude Awakening,/r/IronThronePowers/comments/5inlyn/lore_a_rude_awakening/,"Addam and Sheia were lying huddled in the bed together. It was the day of bad news, the beginning of a new, and terrible war. Addam knew, but was unsure if his young and innocent wife did. Many would die, hundreds upon thousands of dead would be left to rot in their armour, the smallfolk treated like cattle.

His train of thought was interrupted.

""Honey, there is something I was meaning to tell you.""

Addam sighed, his age showing more than it had ever done before.

""What is it Sheia, what is it you want to say?""

He ran his fingers through her hair, and took a couple of deep breaths. He had been running on full capacity the whole day, ever since the ominous letter had arrived that morning. ""The first of his name"" it had been titled.

""Erm"" Sheia could not help the little smile that cracked up her otherwise solemn face, the shine in her eyes was enough to tell anyone what she was about to say.

""we're going to have another baby, Addam..."" The news would have been a great joy to both of them, but for the letter that had arrived in the morning, the ruinous, awful letter. 

The look on Addam's face nearly made her sob, it was a combination of happiness, worry and terror. 

""That... That is... That is wonderful Sheia..."" he said, as she saw a tear forming in the corner of his eye.

""It... Will be born as winter comes to an end, as the beauty of spring brings marvels to the world, it will be... It will be..."" The emotion was overwhelming, the horrible feeling in his gut, the fading smile of his wife. ""... Terrible. ""

"
576jn7,https://www.reddit.com/r/IronThronePowers/comments/576jn7/letter_dear_ceryse/,2016-10-12 21:10:08 UTC,IronThronePowers,0,[Letter] Dear Ceryse...,/r/IronThronePowers/comments/576jn7/letter_dear_ceryse/,">Dear Ceryse,

>It has been years since we last spoke, I know, and my son's behavior has been outrageous. I would however wish you to return to New Barrel, I yearn to see Arlan again, my grandson. Deep in my heart I know you are but a loving mother, with the best for Arlan in your heart, Raynald is no good father, but I am the best grandfather a child could wish for. Also, New Barrel has been fairly lonely the last few months, with Raynalds constantly afoot, and my sister Mira has had but little time to accompany me. Even if you don't wish to stay, please come.

>My best wishes, Addam Fossoway"
6i5lyj,https://www.reddit.com/r/IronThronePowers/comments/6i5lyj/reclaim_my_internet_returned_unexpectedly/,2017-06-19 10:41:31 UTC,IronThronePowers,0,[Reclaim] My internet returned unexpectedly,/r/IronThronePowers/comments/6i5lyj/reclaim_my_internet_returned_unexpectedly/,"Heck, I did not expect this.

Anyhow, EventhoughIneverreallyunclaimed I now claim house Fossoway of New Barrel as my own!"
6keltl,https://www.reddit.com/r/IronThronePowers/comments/6keltl/event_coming_to_osmunds_rest/,2017-06-30 08:09:41 UTC,IronThronePowers,0,[Event] Coming to Osmunds Rest,/r/IronThronePowers/comments/6keltl/event_coming_to_osmunds_rest/,"###The Eighth Month

The trip to Osmunds Rest had been quite long, and Othello was quite weary as his horse finally began to approach the gates. Fastened at his red horse was his own, unique [shield](http://imgur.com/a/3DYpf) bouncing slightly as he rode. When the Knight and his two companions arrived at the gate, he hailed the guards. ""Hail, I am Ser Othello Foss, come to meet the Lady Lavendell!"""
5x9ce7,https://www.reddit.com/r/DawnPowers/comments/5x9ce7/heading_south/,2017-03-03 08:53:09 UTC,DawnPowers,0,Heading south,/r/DawnPowers/comments/5x9ce7/heading_south/,"Long had gone since the Ainúri had explored the northern river, and they itched yet again for the unknown. Thus, they headed south on the water of Ulmo, [following the coast](http://imgur.com/a/lU1HZ) as they went.

They traveled in wooden boats, armed with fishing nets as well as some spears and shields. They had supplies to last for two weeks, without fishing.
"
f3v3lt,https://www.reddit.com/r/ColdWarPowers/comments/f3v3lt/diplomacy_soldiers_for_the_war_guns_for_the/,2020-02-14 17:02:45 UTC,ColdWarPowers,0,"[DIPLOMACY] Soldiers for the War, Guns for the Soldiers, Bullets for the Guns...",/r/ColdWarPowers/comments/f3v3lt/diplomacy_soldiers_for_the_war_guns_for_the/,"What the Jordanian High Command had expected to be a swift victory over vastly inferior Syrian forces has turned into a bloodbath, with Turkey coming to their aid. Sir John Bagot Glubb, also known as Pasha Glubb still holds significant influence within Jordan, but even so, British presence there has little solid ground.

So, in exchange for documents in ink, support and materials for the war effort can be secured, at least this is the hope, as PM Tawfik heads to the British embassy in Amman."
akmkn6,https://www.reddit.com/r/LifeOfJohnnyMopper/comments/akmkn6/johnnymopper_abroad_in_2013/,2019-01-28 11:27:35 UTC,LifeOfJohnnyMopper,0,JohnnyMopper: Abroad in 2013,/r/LifeOfJohnnyMopper/comments/akmkn6/johnnymopper_abroad_in_2013/,"It's summer 2013, and JohnnyMopper is walking the dog in a foreign country with a female friend he met a few years ago in said country.

Since she doesn't speak very good english, and he doesn't speak her language very well, they frequently use google translate to communicate, but rhey have a decently good time anyway.

So, she asks Johnny in broken english ""Sleep with I?""

Johnny is quite confused by the question, and asks her to write it through google translate. It comes out ""Do you want to sleep with me?""

He laughs a little and replies ""No, sorry, I can't sleep over, I'm staying with my grandparents here.""

She looks a little disappointed, and they never talk about it again.

It took years for him to realize what she meant.

"
8ybxbj,https://www.reddit.com/r/Kaiserreich/comments/8ybxbj/every_man_a_king/,2018-07-12 17:40:13 UTC,Kaiserreich,0,Every man a King,https://i.redd.it/1genmpn10k911.png,
akd0jo,https://www.reddit.com/r/SevenKingdoms/comments/akd0jo/death_lore_third_time_is_apparently_noy_the_charm/,2019-01-27 15:38:56 UTC,SevenKingdoms,0,"[Death Lore] Third time is apparently noy the charm, at least for Tarlies",/r/SevenKingdoms/comments/akd0jo/death_lore_third_time_is_apparently_noy_the_charm/,"It had been jarring to see Roger be killed, she had hoped that he could escape the vile reach of the peake tyrant. She spat some blod on the floor, and pain seared through her bleeding gut. The wound had made it impossible to fight back, and it made her wonder what the maesters used to train their surgical skills. 

The soldiers had taken her to their lord, and she almost laughed in his face, instead, she coughed up some more blood. At least her death would bring ruin upon his house, and Alayne would carry on the fight for her, at least she was safe.

She looked up at the holder of her sword, ""At least I ha..."" the cough overtook her again, splattering some blood upon the orange cloak of the Peake. ""..had the guts to come to my trial"", a few more coughs...

At least she was right. The sword came swinging down. Ellyn smiled a little, '*It's almost a tradition now*', was her last thought before the ghost left her."
erkyrp,https://www.reddit.com/r/SWWP/comments/erkyrp/diplomacy_event_a_cold_winter_evening_gothenburg/,2020-01-20 22:34:42 UTC,SWWP,0,"[Diplomacy] [Event] A cold winter evening, Gothenburg 1923",/r/SWWP/comments/erkyrp/diplomacy_event_a_cold_winter_evening_gothenburg/,"Three well-dressed norwegian men enter a coffeehouse, and take a seat at a table, ordering something to drink. Back home, winds are changing, and they don't like it. Having met previously in Oslo, and exchanged a few telegrams with some personal contacts in Sweden, they arranged to meet here. Thus, they took the train from Oslo to Gothenburg.

Two of Norways richest men, [Sam Eyde](https://en.m.wikipedia.org/wiki/Sam_Eyde) and [Johan H. Andresen](https://sv.m.wikipedia.org/wiki/Johan_H._Andresen), as well as an officer in the Norwegian army, herr [Vidkun Quisling](https://sv.m.wikipedia.org/wiki/Vidkun_Quisling) are here, yet not on any matters of state, but personal business, meeting personal friends, discussing ""personal"" matters."
9d6ryi,https://www.reddit.com/r/eu4/comments/9d6ryi/bug_unable_to_land_troops_on_this_island/,2018-09-05 13:56:27 UTC,eu4,0,[Bug] Unable to land troops on this Island >:(,https://i.redd.it/tdwutq48efk11.png,
ew4b9q,https://www.reddit.com/r/ColdWarPowers/comments/ew4b9q/event_education_reform_and_extending_the/,2020-01-30 11:57:27 UTC,ColdWarPowers,0,"[EVENT] Education Reform, and extending the government to the West Bank",/r/ColdWarPowers/comments/ew4b9q/event_education_reform_and_extending_the/,"King Abdullah had always admired the wonders of the west, and the west was largely the reason that the Hashemites had been able to bring down the ancient tyranny of the Ottoman Empire so long ago. The world was changing, so much faster than he could keep up. Even so, he would do his best for his people. This was why he started the reform of the Jordanian Educational system, modeled after the British standard.

While education in Jordan has previously only been for the wealthy, primary education (ages 5-11) will not only be free of charge, but those attending will recieve a free meal. The hope with this is to incentivize even poor parents to send their children to school. In addition, lessons will primarily be scheduled in the mornings, so that the children are free to help their parents, or work.

Since neither the boys nor the girls have come of age at during primary education, classes can be hosted for boys and girls together (without angering any religious people).

---

In conjunction with the extension of primary education throughout the country, the province of the West Bank is also established, its first tasks to rebuild the war-torn area, and arrange temporary lodgings for all the refugees."
bydt76,https://www.reddit.com/r/SevenKingdoms/comments/bydt76/event_disastrous_delays/,2019-06-08 23:11:00 UTC,SevenKingdoms,0,[Event] Disastrous Delays,/r/SevenKingdoms/comments/bydt76/event_disastrous_delays/,"After incredible delays due to unknown reasons, Delena has finally arrived in Kings Landing and enters through the mud gate."
eoda4j,https://www.reddit.com/r/SWWP/comments/eoda4j/event_1921_formation_of_government_jeg_er_også/,2020-01-14 00:35:10 UTC,SWWP,0,"[Event] 1921 formation of Government - ""Jeg er også kommunistenes konge.""",/r/SWWP/comments/eoda4j/event_1921_formation_of_government_jeg_er_også/,"The 1921 elections of Norway were a huge upset, the Arbeiderpartiet gaining more than half the seats in the Stortinget. As Stortinget went into negotiations, Otto and Gunnar,  Prime minister and leader of the Venstre (liberal) party respectively went to *det Kongelige Slott* (The Kingly Castle) and advised Kong Haakon against appointing Kyrre Grepp, leader of Arbeiderpartiet (The Workers Party) the new prime minister, citing him ""a dangerous revolutionary"". 

According to the norwegian newspaper *Aftenposten*, he replied ""Jeg er också kommunistenes konge."", in english ""I am also the king of Communists."" confidently. Unlike other monarchs of the western world, he had been appointed by his people, only fifteen years ago at an overwhelming eighty percent majority. Soon after, Kyrre Grepp was appointed Prime Minister.

While some worry that this will mean radical change, life goes on in many quiet Norwegian towns, with little care for the larger world.

Even though they recieved slightly above 40% of the popular vote, the *Lagtinget* which in Norway is the upper house of parliament and has slight influence over the seats in lower parliament (Odelstinget), did not give Arbeiderpartiet a single handed majority. While this lessens the power of their government, some argue that it might lead to resentment amongst the voters, and ultimately radicalization."
